RecordingDate,Name,Gender,Location,Field,Q1,Q2,Q3,Q4,Q5
9-Oct-20,Pietromonaco,Female,North America,SC,"One aspect of social life that is clearly impacted by the current pandemic is couples’ relationships. As a result of quarantines and social distancing, married and cohabiting couples are spending more time in the same space; often, while they're facing significant stress from an array of problems, such as financial losses, changes in their jobs or unemployment, lack of daycare and school closures and the daily stress of falling precautions to avoid contracting the virus. Some couples may be resilient in the face of these significant stressors and benefit from the opportunity to spend more time together, to work together, to solve problems, and to support each other. And by facing adversity together, their relationships may become even stronger in the long term. We know from a large body of research, that having supportive, well-functioning close relationships is closely tied to better emotional and physical health. And so an additional positive impact is that couples who are able to be resilient over time also may do better in terms of their health, and general wellbeing.","People will need wisdom about how to effectively communicate with their partner, especially about conflicts, as well as how to be supportive and responsive. Effective communication means avoiding being hostile and critical, giving your partner the benefit of the doubt when mistakes are made, and directly engaging in problem solving together as a team, with both partners being motivated and invested in improving the situation and willing to compromise when needed. Providing effective support means listening attentively to partner's concerns and being responsive to and understanding your partner's needs. For some partners, emotional support and comfort may be most helpful. Whereas for other partners providing concrete practical support may be most helpful. The pandemic also may open opportunities to expand and strengthen relationships not only through effective communication and support, but also by providing opportunities to spend more time together, to do enjoyable activities together, like playing a relaxing game or sharing happy memories. Because these types of activities build closest and allow for growth in a relationship. ","I just suggested that some couples will capitalize on opportunities for growth in their relationships. But these are likely to be couples who are not particularly economically or socially vulnerable. We know from many research studies that when people are faced with stress that comes from outside the relationship, such as financial or job stress, they're more likely to interact with their partner in ways that are potentially damaging to the relationship. They're more likely to be overly critical, or argue, to blame their partner to find it harder to listen to their partner's concerns and understand their partner's perspective. And over time, they may become less satisfied with their relationship and may even break up. So couples who are most vulnerable, those facing the most severe economic hardship, also may suffer the most damage to their relationships over the long term. ","There is tremendous variability in how the pandemic is affecting couples’ relationships, and how it may continue to do so even after the crisis ends. Couples who are struggling the most, who have major financial concerns have other vulnerable abilities such as emotional or physical illnesses, who have young children at home, or who are members of racial and ethnic minority groups, who are more likely to face severe stress from the pandemic, as well as stress from systemic inequality and discrimination are at the most risk for these couples. The wisdom will come initially from a societal effort to put in place social policies that will alleviate some of the burden and increase the likelihood that couples can effectively communicate and support each other. Couples who are not as vulnerable will do best if they practice communicating constructively, need a supportive caring partner, and engaging in positive enjoyable activities with their partner. ","Realize that stress makes it harder for everyone to talk about problems in constructive relationship protecting ways and so it is especially important to give partners the benefit of the doubt rather than blame them and to keep in mind that the pandemic, not your relationship or your partner, is likely the primary cause of many problems people are experiencing and that eventually, the crisis will be over. And because supportive close relationships are closely tied to health, doing what you can to strengthen your relationship during this challenging time is also making an investment in your and your partner's longer term emotional and physical health."
12-Oct-20,Pentland,Male,North America,Non-SC,"I think the biggest change will be where people will look to their community rather than the central government, or sort of the big guys. Help comes from people nearby and the people you know, not necessarily big systems and society. ","Perhaps, the biggest problem in our society is just the lack of trust in institutions. Trust, which is different than reliability, seems to come mostly from working with people, from actually interacting and knowing that they have your back. So the way to rebuild trust and make society work again, is to start working with the people around you to build back. ","I think people are beginning to realize that all of the media are driving craziness. They're all driven by cliques. Not just Facebook, The New York Times, as well. They're all just trying to make us crazy. And I think that we ought to do something about that. ","Well, I think the way we think about news, about information, will undergo a big change. I think that probably, hopefully, much more local conversations will take its place, where you can get a feel for what's really happening on the ground around you, from people who you know, who don't make money by making you crazy. But we'll see, won’t we? ","I think people need to try and keep in mind that this isn't as bad as 1918. It's not as bad as 1930. And it's not even as bad or it's about as bad as 1960. People don't think of 1960 as bad. But the flu then was a similar sort of death rates. And we were in the middle or the beginning of the Cold War. For instance, when I went to school, we had to practice getting under our desks, because that way we would live through the nuclear flash. Right? I mean, we made it through that. We passed the Civil Rights Act. We did a number of positive things. And I think we can probably do that again."
13-Oct-20,Hertwig,Male,Non-North America,Non-SC,"Well, let me first say that, as we all know, predictions are hard, especially when they are about the future. And another important insight that we should keep in mind is that nothing is per se, only positive or only negative. A lot of these things have unintended consequences, and they can be negative and positive. So, in answering your question, I think what the pandemic will do, it will work as a catalyst for a stronger digitalization, the impact of digital technologies on our life. And that is, in my view, going to have major consequences, of which I hope most are positive. It will affect the way we educated. It will affect the way we live, where we live, in cities or on the countryside. It will affect the way we work, our working hours, it will affect the way we shop, it will affect the way we interact with each other. These are going to be major changes. That will be my prediction. ","I would say two things. One is to have a good attitude of an experimenter, things will be different. And we need to experiment and we look at the consequences of our behavior and how it interacts with the world and act accordingly or choose accordingly. And the other one is the wisdom to discern between the good and the bad consequences of the impact of digitalization on our lives.","I think, unfortunately, the most notable difference that I fear is going to occur is an increase in inequality. I think that as a consequence of this pandemic, certain jobs will disappear. The importance of education will increase and some people in the way we educate now will be left behind. We will also see differences, of course, between countries. So, I think that both within our countries individually, but also globally, we will see, unfortunately, a real increase in inequality. ","Here I actually think I would not expect that the solution lies in the behavior of the individual. But, I think here society and institutions are particularly important and I think they have to provide the foundation, the scaffolding for coping with these inequalities. ","Here would just say one word: care. And with care, I mean care about ourselves. That means exercise, eat good food, think about what you really like and enjoy and do it. But also, care about other people. Care about other people, care about your family, care about your friends, help where you can without jeopardizing your safety. Helping other people, it's also something that makes us feel good, and is good for wellbeing. So, care."
13-Oct-20,Norton,Male,North America,SC,"One of the things that I think the pandemic has really highlighted even more than it was already being highlighted is inequality, not just income but in health outcomes. If you look at the people who are most affected by COVID, it's older people, it's people with pre-existing health conditions, it's lower income people, all people who are vulnerable in one way or another. And the pandemic sort of throws that into stark relief, even though we're aware of it, now we can really see how this plays out in the health domain. My hope is that people will see inequality in a different way than they were seeing it before and hopefully be more motivated to do something about it. ","We've seen in our research for 10 years now that people are pretty unaware of inequality. They're aware that things aren't equal, but they're often really not aware of the extent of inequality. And we've been looking for ways to help people understand the extent of inequality, so that they might be more motivated to do something about it. I think when these unfortunate events happen, but they show us the world as it really is, the goal is that that knowledge will then help people behave differently going forward and think differently about the distribution of things, not just money, and not just wealth, but health and life and things that we really hold dear. ","I think this is going to vary a lot by country-to-country and by city-to-city and even by neighborhood to neighborhood. But, the role of trust in everyday life, I think, has taken a big hit. Both trust in big institutions like government and health agencies across the world, but also local trust in your local governments, and even in your neighbors and in your communities. Because we've been so isolated, and because we got hit by such a negative, external blow, it's hard to trust anymore. When things are going so badly, it's hard to know that you could ever trust again a big organization or even the people in your community. So there is, I think, a real worry, that that trust won't rebound a little bit so that we can have some faith in institutions and have some faith in our communities as we move forward. ","Trust is such a funny word because we know it's so important. Everyone would say trust is important in government and in your relationships and things like that. But, it also often feels nebulous. What does it mean to trust somebody or not trust somebody? My sense is that trust has been so broken that it will take quite some time and a lot of actions to build it back up. So you'll need to see that people in your community can be trusted, for example, to take care of your health by taking care of their own health. And you'll need to see that institutions can actually deliver on the promises that they have been supposed to be delivering on. And that's going to take some time and also some understanding in order to build it back up. ","Another thing that we've been working on for quite some time is the role of rituals in people's everyday lives. I don't mean rituals, like religious ceremonies, although those help to. But I mean little rituals that we all have with our romantic partners and in our families and with our co-workers. And those all got really disrupted during COVID, for a million different reasons, because our lives got turned upside down. And we've been looking, actually, to see at when people are developing new rituals and new routines in life, how that can help them deal with the stress of what's happening a little bit more. For example, parents who develop new rituals with their young children around mask wearing and hand washing feel better about their parenting because they they're taking control, and they're engaging in rituals with their kids. By rituals, by the way, I mean, first the bunny says something and then we read this other book. I don't mean rituals in a scary way. But these little rituals that people bring on board with grief, for example. We can show that they actually really can help you cope with these issues. They can't solve them, but they can help people cope with them. "
14-Oct-20,Zacks,Male,North America,Non-SC,"I think one thing the pandemic has done is broken some habits. One of those that's striking to me is business travel. Lots of us had all these trips scheduled in February and March that just disappeared. And this is no doubt induce some social and collaboration costs, but also has had real benefits for families and for the environment, reducing our carbon footprint. And I think we should take advantage of that lesson. ","Here, I think, history should lead us to be pessimistic. When a crisis hits, we often have this feeling that everything has changed in some domain and that it's going to stick forever. But history tells us that often the crisis ends, and things snap back. So, I think the big challenge is to take new habits that we discovered to be adaptive as a result of a crisis and make them permanent. And to avoid being seduced by habit-driven behavior that is from pre-crisis that we don't want to go back to when that's more adaptive. ","I'd start by saying that I think the big obvious negative consequences are social and psychopathological. And these are not to be neglected. But they're also not so much an area that I have expertise in. One issue, which I don't think is as important, but I think is pretty interesting and is of some importance concerns episodic memory. And the issue here is that we know that differentiating context is super important for burning in effective, episodic and autobiographical memories. And our normal existence offers a bunch of contextual cues that have been eliminated by living on zoom. So, in my normal life, I might teach a class and then walk from one physical location to another and have a meeting, and then ride my bike across town for a lunch or another meeting. Now, I go from zoom meeting to zoom meeting, as do we all. And lots of folks have told me that they feel like one event just blends into the other, blends in together in their memory. And I worry that we may wind up with a kind of collective fog in our memories for these couple of years. ","My advice is to cheat. And what I mean is use external aides to support your memory. We're lucky in this regard that we do so much on email, because if you save your emails that provides an ongoing record. But we can also take notes, we can make recordings, we can take pictures. I also think we can do some things to increase the contextual cues in our ongoing days. So if you're just getting up from the computer, which is good for lots and lots of reasons, you know, taking a walk, getting out making a cup of tea... Breaking up your day in that way can help boost the contextual segregation of memories. ","I wish I had a lot of wisdom here. And I'm just speaking, not as a psychologist, but just as a person. And speaking as a person, what I would say is, this is a time for all of us to have a lot of grace, for ourselves and for our friends, and family and colleagues. I also think it's important in the midst of all the horrors that this pandemic brings to take advantage of some of the silver linings. We have more quiet moments and it's worth appreciating those. We have maybe a little more opportunity to get outside, and I think that getting outside has lots of benefits. "
