RecordingDate,Name,Gender,Location,Field,Q1,Q2,Q3,Q4,Q5
26-Jun-20,Mendes,Female,North America,SC,"It’s interesting to think about some of the positive aspects of the pandemic because what we know about human behavior and how we respond to stress is that there aren't always negative effects associated with stress, and that’s where the idea of resilience comes from, that people have the ability to adapt to new circumstances. And even in research where of maternal caregivers is the mothers with sick children, about 25 to 40% of women with sick children end up looking healthier because they find meaning in life and resilience. The idea that the pandemic could potentially create more resilient profiles and understanding of meaning in life of what matters. And what matters is our loved ones, the people around us, our society or communities. When we consider the positive changes of the pandemic, the fact that people are connecting with old friends with remembering the values of the family because now they can't see them in some cases, helps remind us of the important things in life and so I think that is one of the positive changes that we could see.","People are going to have to figure out a new normal of communication. Now, we're lucky in a weird way that the pandemic hit when the ability to FaceTime or have zoom conference calls, hit this new peak, we used to have these audio conference calls where you didn't have the luxury of seeing people's faces and knowing the natural pauses and always the funny examples of people talking over each other. So I think this ability to be able to connect with people virtually, will help this positive change, help us connect, remind us that we can reach out and no you can't, touch your loved one, but you can find sort of solace in being able to communicate with them directly over video.",,"When we're thinking about negative changes, it's important to think of the history of us as social beings and for millennia we have been used to and we've evolved to communicate with people face- to-face, in fact, it's only in our very recent evolutionary past, have we had the ability to communicate over video or telephones. So we have evolved to see each other and not just see each other, but also all of our senses smell, hear, directly touch. And so one of our critical sensorial features of communication is something like touch. Now, touch is powerful, especially when we think of it, in our smaller, close family circles. We're used to touching people we love, our family. We know from work, for example, by Jim Cohen, who shows that stress centers and fear centers in the brain down regulate with human touch, and it doesn't even have to be a loved one. It could be a stranger, so touch is powerful. And I think we're going to have to get used to not touching people. Even the idea of a handshake, extending and touching somebody who you're just meeting is useful. It's a way to sort of break down this barrier of being strangers and something like that right now would be ill advised. So we have to come up with ways to communicate, social connection and more, that doesn't require touch, and that I think will be very tricky for people, especially more in a Western culture. People are going to have to think about why something like face-to-face communication and touch, why that makes them feel better and trying to find a proxy that fits. Something that my friends and I have been doing, because we tend to be fairly touchy and we hug each other every time we see each other, is that we've been hugging ourselves. If we get together and socially distance in an open environment, and when we see each other, we come up to each other, we hug ourselves. It felt really silly the first time we did it, and now it's become more natural. And it feels when we do it and we see each other simultaneously. That synchronized process has created that same feeling. Now, I'm not suggesting that's what will fit for everybody. But I think we have to start coming up with these new ways to alter what feels natural into a new natural. And we know individuals have this ability to adapt to new naturals, they just take a few times and getting used to it and then try it and see if that is a good substitution for you.","What this pandemic has done is created unprecedented amounts of uncertainty. So how do we start regulating uncertainty given that is our new normal? Here's a couple things that I that I suggest. One, there are elements that you do have control over, there is certainty in your own small circle. So instead of a certainty about a vacation, which may or may not happen in three months, or what Christmas this year looks like or whatever the December holidays are, what that looks like for you, those plans may change. But what can you predict? What do you have certainty over? You can start creating small little traditions within your closest family circle and say, next month, we're going to have game night for three nights, or next month, I'm going to start the outline of the book that I'm going to write. Things that you do have control over, that's where you're going to have to start thinking about that's where my certainty comes from. And there are elements of my life and the world that are going to be a bit more uncertain right now. And that ability to get used to uncertainty is very difficult to have, to give yourself a little bit of self-compassion and your family members and your friends who are all struggling with this same problem. There are some people who really value certainty and some people who are more comfortable with uncertainty and we have to also recognize that individual difference among the people we love."
14-Jul-20,Kashima,Male,Non-North America,SC,"A change is the belief in change. People are going to think that there will be change and that belief of future changes are going to create changes themselves, in many ways, because they think that it's possible to change and they'll begin to act on it. So  the best thing that happened is that people are now beginning to think that there will be a change.","We have to have a will to keep imagining what may be a better way of living. So keep thinking, what may be a place where we can improve and just keep imagining, and participate in the kind of conversation that we keep talking to each other about, what that might be. And not necessarily imposing that utopian vision, or a better way of living. But to have a discourse about it, and to keep on talking, and try to act on those sorts of ideas. Check on the veracity of it, and the acceptability of it. To keep on talking and acting.","There will be a change and not all changes are going to be good for everybody. So there'll be something bad happening and the good changes as well. The power of a state, nation state that is going to increase in some parts of the world, but say in other parts of the world that might fail. And what that means is that the kind of institutional support for civil society and everyday life may be weakened especially in some failing states, but it can be strengthened for better or worse in some other parts and that could be a major problem in some areas. So, it could be positive in that the state power might enter say a domestic living and that could reduce for instance the problem of domestic violence at the same time, that means that the some of the sanctity of family life could be eroded, and the state power can come into that sort of private living. ","We have to have a will to keep imagining what may be a better way of living and participate in the discourse and acting on that. You just have to collectively, but locally, improving the way we do things.","We have to have a will to believe. Believe in and trust humanity. At this point in time, I think it's really important for me, personally, to believe in humanity, hope that they keep on hoping I guess, have a will to hope, that there’s a better way of living into the future. "
6-Jul-20,Uchida,Female,Non-North America,SC,"My own research on the Great East Japan earthquake nine years ago in Japan suggested that people re-evaluate their ordinary lives and the strengths and their feelings of the gratitude towards family members or social networks. This coronavirus pandemic is also affecting their social bonds and we can re-evaluate how the pressures that each social bond we have. Then, in Japan, the most positive changes that people are able to see, the balance between work and private life. In general the Japanese business people stay in their office, longer time than other countries. Before the pandemic Japanese businessman, feel pressured by collectivistic organizational culture to work together and monitor each other. So the evaluation system is based on long working hours, the long working order signal for the high motivation and the commitment to the workplace in Japan. So, in addition due to the centralization in the Tokyo area, many business persons should commute by crowded trains and the average length of the commuting is around an hour. One way, I mean this will total two hours per day. So now after coronavirus pandemic working at home is more likely to be prevailed in Japanese context too. Then we can extend our family time and maybe this is the kind of moment to re-evaluate how precious our  significant other social relationships closer to each other. And the impact is far greater than other countries I think, maybe because of the gap between before the coronavirus pandemic and after coronavirus pandemic. So after teleworking, they found that it is not necessary at least some types of help, to go to the office while their sacrificing time for a long commute. Their now working style in the cultural norm should be changed. And in terms of the universal perspective, we can be more flexible to connect internationally with each other via SMS and an online communication. Before it was very common to visit some people by flying long distance to have a meeting. Holding an online meeting was optional at that time, but now it is becoming a standard that even small children can communicate with their family and relatives online. This is a new way of feeling connected each other so this is the kind of the positive impact to seek our new social life. So online and seeking work life balance.","We need to improve our skill of the imagination in communication to supplement the missing information via online. So online conversation is easy, it has a lack of contextual information. So sometimes many people say for example, the Japanese use high context information during a conversation, like in a small signal of the emotion or some behavior as well. So it is usually easier for communicating online when the target person is already known. Because we can supplement the missing information with our knowledge of him or her, but it is difficult to communicate with the strangers online because we cannot have a background information. In that case, to avoid such kind of a risky perception, we need to be tolerant. And we should be explicitly aware of what kind of cognitive heuristic we have when interacting with other people online. We have to ask ourselves: Do I have any stereotype, or do I have a cognitive bias? And having such an alert toward ourselves should be quite important to have a nice positive change in this pandemic time.","In a Japanese context, they still feel that we have to monitor the work of colleagues or subordinates, even when the employees work at home. So, it is due to the system of evaluation, which depend heavily on an effort rather than the outcome. Maybe some types of the cultural context they pay attention to the time to make effort rather than outcome. So the under such cultural context we need to have some changes and without such changes this might have some negative impact because some people just try not to have evaluation by outcome of the work. This is kind of big challenge for us to shift from the effort base evaluation system to outcome evaluation system. It's kind of stressful for us. And we have another impersonal small chat, type of the conversation. So, for some people who do not want to be disturbed by others, reducing the possibility to have a chat with others could have a positive impact, but others, however, maybe they miss such kind of refreshment or brainstorming or information sharing we usually obtained from the small chat in social interactions. But if they have no such kind of relationship and they feel lonely, then this kind of change also worsen their feeling of the loneliness. So that maybe should be overcome from the some societal wisdom to protect the people from the feeling of loneliness.","We have to re-evaluate the social network seeking strategy. And then security network, I mean, not only focus attention to the positive social network, but rather, maybe we have to think about the secure network of the social life as a social security system, so the infrastructure will be of the social bonding is necessary to be built up. So nowadays and that SMS is based on the automatic or more likely to be promotion focus seeking behavior to seek some partner, communication partner. Well, maybe not only that kind of the part, but also maybe we have to stretch out our security network. For those who are not so extraverted, for those who are not seeking new opportunity to have a friendship, rather, maybe we have to think about the person who are more likely to be introverted, more likely to feel loneliness, or more likely to feel sadness or hesitation towards the social network. So I think we have to build up some secure network for such kind of people.","It is important to stop and rethink about what we have defined as normal life as very normal or not. Was it normal to commute more than one hour a day? Or was it normal not to talk to your family members because you were so busy, or was it normal to fly frequently to other areas in busy schedule? Or was it normal to make a lot of consumption in a daily basis? I think this situation we have to think about, what is our individual happiness and what is our societal happiness. Recently, I think before coronavirus pandemic, we defined some normal life as lots of consumption, lots of mobility and busy life we defined as normal. But maybe, it's kind of too much for us and also we have to think about the good balance between individual level happiness and also societal happiness which can construct each other. But sometimes, of course, they're controversial or conflict each other. The pursuit of individual happiness and selfish behavior makes society uncomfortable sometimes, or sometimes the individual happiness is sacrificed for gross profit of society. Now we have time to think about what is very valued. Because of the very strong pressure by pandemic, we have time to stop and think about what is very normal and what we are seeking for future happiness."
21-Jul-20,Kenrick,Male,North America,SC,"You're probably going to see an increase in relationships between kin because those are the people now that we're spending more time with. We're concentrating on a smaller number, instead of hanging out at bars with 50 people, we're now hanging out with smaller groups with people and the easiest people to hang out with are your kin because we feel most comfortable around them, we see them most frequently. Tighter family relationships would be the most positive outcome of this.","In North America, there's this tendency to think you've got to stand on your own, you've got to be separate, people move out of their home, even when they don't need to, when not getting married, they'll move out of a perfectly large house with five bedrooms, and they're the only person living there because they need to be separate. And so I think there's a force in our society that says you need to separate yourself, but I think that's sort of the one obstacle is that look, it's okay to be friends with your kin. You can trust your kin and it keeps the network of potential infections smaller. So again, I think people will do it naturally. And the only wisdom would be, don't pay attention to your cultural value that you should separate yourself from your family.","There’s going to be more aversion towards outsiders. When people are concerned about disease, they're especially likely to want to distance themselves from people, from foreign places, and that's particularly true of foreign places that they're not familiar with. Americans and Canadians will probably get over the border between us. But people from strange exotic places are going to experience more prejudice by people from other places. And so I think there's going to be more ethnocentrism, not necessarily ethnic, but kind of, geocentric, there's going to be more geocentrism. We're going to like the people around us and be averse to hanging out with people from faraway foreign places.","I think that you're going to have to be considerate about who are the people that you're interacting with. It is going to be automatic wisdom: once you become familiar with somebody, they're no longer a foreigner. You know, they're sort of a member of our ancestors. You had people come in occasionally from other villages, most typically, a guy would marry a woman from another village. At first, she'd probably get excluded, but then eventually she became a familiar face, she became part of the group. And I think that, if you're an outsider and you want to be accepted, don't necessarily push too quickly, just become familiar, say hi from a distance. Let people get to be familiar with your face, and who you are and recognize you as a part of the neighborhood and then eventually you will be a part of the neighborhood.","My advice is that, not to be too panicked about it. We've been through this before, and just stay relaxed, enjoy the time to contemplate, not being so overwhelmed by crowds of people. I guess what I would be thinking about is to what extent can I get into things like media outreach, there's going to be a lot more online learning, there should be opportunities that open up in terms of technological communication between people. And if I were young and had a job as a waiter or waitress, I'd be trying to learn some of that stuff. So that I can be ready for the for the future, we're never probably going to stop interacting online the way we are now because it's so convenient. Learn about these things, learn about this technology, because there's going to be some money in it. "
22-Jul-20,Osin,Male,Non-North America,Non-SC,"The most important positive change is concerning the ways we communicate and cooperate when we strive towards common goals. During this lockdown, we have learned to be more flexible and more efficient, and many work events and activities that were thought of as quite indispensable, are now appearing less necessary and they can be more easily organized online. We have also learned to be more tolerant of one another to accept the unavoidable limitations in ourselves, in our colleagues, in our significant others, and being reminded that our powers are limited. That life itself is limited, can help us to become more mindful of our priorities, and to be more aware of where we choose to invest our time.","We need to remember that life is about changing and growing as we deal with adversity. And we cannot really step twice in the same river, this pandemic is bringing about some lasting changes. And once it's over, life will not be the same as we had before. The best we can do is not to struggle with this fact but to embrace it and learn how we can make best use of this change. ","This pandemic is a real threat, which reminds us of our mortality. And this is something many people might not be quite prepared for. Research shows that when we are faced with a threat of death, or with some greater uncertainty, we might stop thinking critically and we might start behaving in more irrational ways. This pandemic might encourage further growth of black and white thinking, conspiracy theories, prejudice and social antagonism. ","What we need now is mindfulness to help us cope with our anxieties and to start taking our threats and problems for what they are instead of explaining them away. Instead of feeling upset, or sorry for ourselves, because we are not living in an ideal world, we can accept the complexity of life and of other people. Life can be ugly, terrifying and awful. But it can also be beautiful and amazing. And by acknowledging the bad stuff, we can start truly appreciating the great many positive things that are also happening each day. As the Dalai Lama says ""if in the morning you wake up and you’re alive, this is already so much to be grateful for"". And this pandemic reminds us of this simple wisdom. ","Let's treasure and let's appreciate the things that really nourish us, our relationships, our friends, our families, our enthusiasm at work and our sweet moments of idleness. There's time for great deeds and there's time for Netflix and chill. So being friendly, open and compassionate to ourselves can help us become more open and compassionate to others and in the end, to get through this challenging times."
