RecordingDate,Name,Gender,Location,Field,Q1,Q2,Q3,Q4,Q5
16-Jul-20,Choi,Male,Non-North America,SC,"Family will become more important than ever. Due to social distancing during this pandemic, our social life has been substantially diminished. However, very ironically, our close relationships, especially family became more crucial in our happiness. ","Work life balance. We need to decrease our work time, increase our family time. Companies should restructure their work culture so that employees can have better work-life balance. I think that's the wisdom we need. ","I'm very concerned about the general trust level. Individuals might distance themselves from other individuals, and especially other group members. Consequently, stereotypes, prejudices against other group members might arise. And that's the area I'm really concerned about. ","Psychology has long been dealing with these prejudice issues. This pandemic taught us that we are all biological beings, we are all vulnerable to the virus. So regardless of our race, gender, ethnicity, we are the same biological beings. I think that's the wisdom we need to have. ","We humans, are very wise and strong. Historically, we have experienced these types of pandemics multiple times, yet we have successfully overcame these pandemics. So I think it's very important to believe in our abilities."
26-Jun-20,Twenge,Female,North America,SC,"One of the most positive changes is something we're already seeing, which is in political activism. That, maybe, this might be the end of apathy. Maybe we'll get better voter turnout. Assuming we can find a way to do that safely. That we have more people who are going to  volunteer to work for a campaign. We’ve already seen a big protests for racial justice, a lot of movement around reform around police brutality and so on, that there's just more interest in the civic sphere and in getting involved, and changing government and public policies and so on.","This is where it gets challenging, even though this is such a big positive, we're seeing more people who are interested in social and civic issues, there's ways to do that that will have a bigger impact than other ways. Bringing visibility to these issues is going to be the first step. And that's already happening. But the challenge and the wisdom that people are going to have to tap into here is to think about where can we have the most impact? Protests have had big impact already. But then the next steps are often the more challenging, because you have to figure out: what is the next thing after that? Is it grassroots programs for voter turnout, specific candidates going to work on specific policies, things like that, that will probably end up having the biggest impact. The challenge is going to be trying to find those things, as opposed to some things that may not be as effective. And this is where, it remains to be seen what the most effective things are. Generally speaking, things that are not effective are those that divide other people, that attack other people, that increase political polarization, that vilify you people who disagree with you. My hope is that we'll end up seeing a lot of positive change from this, in terms of policy in terms of civic and government involvement, and that we can try to do this together in a way that's not as divisive. I'm not at all trying to say that this is an easy thing. It's a difficult thing in today's political climate. But I'm hopeful that it can happen and that focus is on that concrete action, rather than quite so much on appearances and quite so much on cancel culture and attacking certain people.","The most negative thing that's happening right now is around mental health. And I have a paper out on that, that’s a preprint, and there's several other studies, one I just saw today, from those who administer the General Social Survey, they sample in May, looking at happiness and happiness is at a 50 year low. And we find in our paper, big increases in mental distress. There's census data, US Census Bureau administer data, looking at anxiety and depression that is also increased by quite a bit during the pandemic. I think it's really clear that we have a mental health crisis on our hands. So we have to keep that in mind, that that's real. That yes, you know, sometimes you're gonna have great examples of resilience and there are a lot of positives, but that for a significant number of people looks like it's up to a third of people, there's some pretty serious mental distress, anxiety and depression going on, probably from the social isolation, from the anxiety around possibly catching the illness, and, of course around economic disruptions, which don't look like they're going away anytime soon. ","I think one thing that has already happened is more of a move to telehealth for appointments, for therapy, and that needs to continue and those regulations need to continue to be loosened so insurance will pay for that, so providers can be reimbursed for it and so on. Beyond that, so much of it has to do with just solving the problems the pandemic has created, the thing that everybody's trying to figure out, how to open up the economy without having an increase in cases. A lot of it is also around social isolation. This pandemic has really shown, it's really laid bare a problem that was there to begin with, in a lot of Western democracies, which deal in person, but by videoconference or FaceTime. Basically, if I really wanted to boil down what I'm saying is call your grandma. And just keep in touch with those relationships because there's just a lot of loneliness out there.","There’s been some real trade-offs in social life when it comes to the pandemic, and it has had some benefits, especially for folks spending more time with their kids. But there's also these downsides that we felt isolated from other people around us. The main thing is just to make that effort in trying to stay in touch with friends and family and try to keep up with those relationships, even though we can't always do them in the way that we did in 2019. To try to support each other and still focus on those relationships, and focus on real time communication, as opposed to being so tempted as we all are, to go to social media and to go to texting, and so on, which is not in real time, and it has those performative aspects to it and just doesn't seem to be as good for mental health as actually having a conversation."
7-Jul-20,VanBoven,Male,North America,SC,"The pandemic is obviously hugely disruptive. One of the things we know is that creates a sense of uncertainty and tentativeness and questioning about the way things work. Many people are asking what is it about the way our society works or the way my life works, that is working or not working. And that's not inherently positive, except that it sets up a frame of mind that makes it easier to change habits because we start to ask ourselves what should be different. Hopefully, we have the wisdom and the insight to recognize things like social relationships are important, and we want more of those. That many pointless meetings are not so valuable, and we want fewer of those. I think that there's an opportunity for positive change that needs to happen with some guidance. And when I say guidance, I really mean the kind of introspection and reflection that people can engage in about what are the important values. Hopefully that happens naturally. I think as psychologists and social behavioral scientists, we can help frame that question, help people think through the answers to those questions.","The issue isn't so much do we have the wisdom, it's do we think about what is wisdom mean for how we approach this situation? What do we know? How could we be better? It's not that we don't know the answer to what are the values we might aspire to, but rather than we're not really aware of them in our day-to-day life, so the wisdom is really more about becoming more persistently aware of those things that we care about and the way we want to structure our lives.","It stems from the same source of tentativeness and uncertainty. We're all asking what comes next? What does this mean for the way our society is structured? Those are difficult questions. And who poses the answers to those questions? Is it the case that autocratic leaders might answer those questions for us, might give us an easy answer where the answer is essentially, it's because of them, it's because of the out group. We know that people can be really easily pulled into these kinds of intergroup conflicts. Given that we're in this moment of uncertainty and tentativeness, will we allow other people provide us with an easy answer that really steers us toward the negative. And it's a very tempting psychological path to go down because it means blaming other people and not really confronting the difficult challenges in our own lives or in our own societies.","It's really reflecting on what we want to influence us. That really sort of asking in a careful way, what is influencing me? And are these the influences I want to shape my worldview? And I think for many of us we’ll realize, no, I don't want my worldview shaped by kind of nasty human tendencies, I want to think better and be better. I think most people have that default response. ","We are far more socially connected than we have appreciated. And that carries tremendous threats. Obviously because we can spread disease, but we can also spread more positive emotions, more positive social connections, and we really haven't fully appreciated how socially connected we are. Coming to that appreciation is itself an important source of wisdom. That it's something both to be valued and guarded and protected in our interactions with other people."
15-Jul-20,FeldmanBarrett,Female,North America,Non-SC,"I would say that as a scientist, one thing we know is that the best predictor of future behavior is past behavior. So, when you look at past epidemics, you can see that in a crisis like this, like the flu epidemic and others, similar, Spanish flu epidemic and at the turn of the century and other epidemics, one aspect of social life that did in some ways get better, was the stratification of society and to some extent, some forms of racism. So one thing that crises do like this is they kind of reveal the cracks in a society. And I think we saw this with just in recent weeks with the reaction to the George Floyd murder and the Black Lives movement, in the United States and in Canada, and in lots of countries around the world, so one possibility is that people will take action, they'll realize that one of our greatest strengths as a species is that we are social animals. And that means that we are necessary to each other's wellbeing. And so hopefully, now that these cracks have been revealed, many of us have known they've been there for a long time. We'll have the opportunity to do something about them.","We have this really interesting dilemma in our species, and that is that we evolved as social animals, which means that we regulate each other's behavior, but it also means we regulate each other's nervous systems. The best thing for a human nervous system is another human. And the worst thing for a human nervous system often is another human. So I think this dilemma that we're in is that we have these socially dependent nervous systems in a culture that prizes and prioritizes individual rights and freedoms. And so I think we have to realize this. And we have to realize that in a culture that prioritizes individual rights and freedoms, we're aware of the fact that we're responsible for ourselves, we're responsible for our own behavior, we're responsible for our own wellbeing. But as a social species, given our socially dependent nervous systems that we've evolved, we also have to realize that we're more responsible for other people, for the wellbeing of other people, than we might know and like. We are responsible for each other's well beings, even for people we don't even know very well, for people who don't look like us, who don't act like us, and who we might consider to be strangers.","It would probably be the same kind of thing in the sense when I said that if you look back to previous epidemics, you can see that there have been efforts that make things a little bit more egalitarian in certain ways where social stratification is reduced in certain ways. But there's also evidence that it goes the other way, that people become more entrenched in their in-group and out-group beliefs. And there's an opportunity, unfortunately, for increased racism in certain cases. In each case, when there’s been a large health crisis it's certain groups that benefit and other groups don't, what I mean by that is certain out-groups benefit and they do better actually, the minority culture broadens to include them more, but there are always out-groups that suffer more too. And I think that's a real danger here.","First of all, history is really instructive. As a species, we cooperate with each other, we copy each other, we learn from each other, we communicate with each other in this really high fidelity way. We're really creative when we work together to solve problems. It’s important to realize that we have this capacity to help each other but also to really harm each other. Unless we're really careful. There are really good reasons to believe that watching out for the wellbeing of other people in the end also makes it easier for you to take care of yourself and the people that you love.","Remember you’re a social animal. Remember that. You need other people to keep yourself healthy. And you need social connection to keep your wellbeing intact. And other people need you. So, random acts of kindness, be kind to other people, treat other people with human dignity. Remember that your biology doesn't only belong to you, you spread it around every time you breathe. If everybody remembers that they can have a good impact on other people or a bad impact on other people they can choose to be the kind of person who has a good impact, they can choose to be their best self."
23-Jun-20,Schaller,Male,North America,SC,"For a lot of people in many parts of the world, particularly those of us who live in these relatively wealthy, modernized parts of the world, the threat posed by infectious diseases has kind of been off our radar, and this pandemic has changed that and as a result that's offered an opportunity at a massive worldwide scale to have increased awareness of, and education about the challenges that infectious diseases pose to people and pose to a way of life that we take for granted. This is maybe even more important, a means through which these challenges can be met. So it's really been an unprecedented learning opportunity. I think particularly to learn about how this is kind of weird and invisible force of nature can be mitigated through the coordinated combination of sensible thoughtful responses by individuals, by communities, by the folks who are entrusted to govern these communities. And these lessons, if in fact, we do learn them, can serve individuals and societies as we face additional challenges in the future.","Given that this positive change is contingent upon learning, there's a kind of a necessary willingness to learn. In particular, there's necessary willingness to learn from past mistakes. So this pandemic because it's been unprecedented within most people's lifetimes, and the means of mitigating the pandemic have required sudden changes in individual behavior and sudden changes in public policy, it's been hard. So naturally, folks have made mistakes, folks have screwed up. At an individual level, this has happened, people have blithely attended church services or gone to nightclubs, and as a result have passed on their incipient infections to other folks. Government officials and lots of countries around the world have been slow to respond or reluctant to take actions that we now know could have prevented millions of infections and thousands and thousands of deaths. And that's a terrible tragedy. And it'll be even perhaps greater tragedy if these individuals fail to admit their mistakes, fail to learn from those mistakes. This is where this wisdom comes in, that if people and that includes ordinary people like you and me as well as government officials, if we have the wisdom to critically self-reflect on the mistakes that we've made and to learn from them, then ideally we'll be better prepared to respond swiftly and sensibly and thoughtfully to future challenges. ","The real negative consequence is that a hell of a lot of people have died and a hell of a lot of people are bereaved, and a hell of a lot of people are experiencing a lasting hit on their health and wellbeing. And it's a massive tragedy. People may be inclined to be more interpersonally wary of other people, even when the pandemic’s over and there isn't that increased risk of infection. People may still act as though there is. For the past several months, we have erected barriers between ourselves and other people. Some of those barriers are behavioral, there are restrictions, some self-imposed, some imposed by others, on who we interact with and how we interact with them. And some of these barriers are physical barriers, like these plexiglass shields that you see in grocery stores now. And I assume that over time, some of these barriers will dissolve. And, certainly the informal ones are likely to dissolve, I'm certainly looking forward to touching, hugging my friends again. But I'm guessing that some of these barriers are going to stick around for a while, and there'll be these consistent, persistent reminders of the pandemic. And that's perfectly sensible from an epidemiological perspective, but it's kind of a drag for interpersonal interaction. And so my concern is that there's going to be this persistent, lasting wariness of interactions with other people, especially strangers. that represents a low level erosion of interpersonal trust and erosion of social capital. ","I think it's a hard problem to solve, in part because I think we humans tend to think, kind of naturally in a bit of a simple minded way about interpersonal trust in the sense that we tend to, either trust people or we don't, and to kind of overcome that, to think of people as simply not just folks I don't trust, we might need to make some finer distinctions, more nuanced, more compartmentalized approach to thinking about trust and that's going to be effortful. I think kind of the wisdom necessary, maybe is something like this, some sort of effort for cognitive strategy of compartmentalizing the risk of infection. So that even if I'm reminded that a casual social interaction brings with it some potential risk of disease transmission, I resist the tendency to over generalize that appraisal to simply view this person as a non-trustworthy person. So that ideally I'll still trust that person in a variety of other ways. And ideally, that person will still trust me, and will continue to appreciate the goodness of this opportunity for the social interaction and we'll continue to seek out rather than avoid casual social interactions with other people.","So, the first one has to do with perspective taking. For a lot of people, some bit of perspective taking can help. That is, what people have been going through, feels hard and the uncertainty associated with it feels hard and the hits that they've taken to their wellbeing, their way of life, to their jobs, to the health of friends and family, it's hard. And in that context, it can sometimes be helpful to realize that almost certainly somewhere in the world, perhaps even right next door, other folks have it harder. And having that perspective can help, make people feel, less overwhelmed by it, a little bit more compassionate for other folks. The second piece of wisdom is, it ties into this thing that psychologists talk about when they talk about a distinction between threat and challenge and how what is perceived to be a threat can be mentally reconstrued as a challenge. So the idea is something like this, that a lot of what's been happening in people's lives feels pretty overwhelming, the threat of disease, the uncertainty about the future and if those are viewed simply as kind of threats, then it can be overwhelming. But if one can somehow make that mental transition to kind of view these threats instead as challenges, hard challenges, hard problems to solve, but still as problems that can potentially be solved through some sort of sensible step by step approach, then it can feel less overwhelming, less anxiety provoking, and if we have some resources to draw upon as individuals, as families, as communities, then we're likely to be able to figure out how to solve those problems. "
